{
  "capabilities": {
    "approval_authority": false,
    "case_completion": false,
    "customer_receipt": false,
    "customer_resolution": false,
    "external_write": false,
    "fixture_local_delivery": true,
    "live_provider": false,
    "model": false,
    "network": false,
    "offline": true,
    "replay_verification_only": true,
    "retry_authority": false,
    "synthetic": true,
    "workflow_authority": false
  },
  "case": {
    "case_id": "case_800d63a3486b66d9d2b6927b600f6049",
    "case_revision_id": "case_revision_7479984cce61504b03058b9aca5ba2d7",
    "latest_checkpoint_id": "workflow_checkpoint_5fa71fdbc7e4bef9f18407fc141e8e52",
    "revision": 1,
    "workflow_id": "workflow_3aa289d85ad18cdc3a5f01f01121e6ef",
    "workflow_version": 12
  },
  "counts": {
    "agent_step_count": 4,
    "case_event_count": 9,
    "case_revision_count": 1,
    "evidence_node_count": 48,
    "fixture_delivery_effect_count": 1,
    "local_ticket_effect_count": 2,
    "replay_result_count": 1,
    "timeline_entry_count": 49,
    "tool_result_count": 3,
    "workflow_checkpoint_count": 13
  },
  "current_state": "DELIVERY_RECORDED",
  "current_state_label": "DELIVERY_RECORDED (fixture-local)",
  "evidence": {
    "node_count": 48,
    "root_sha256": "bb1ac5250562383e75abfe7a275b282612e053dcf58531be56ed7c2e7d04a5d7",
    "timeline_source_sha256": "8f884e86a55fdaa9c0a9990030168bb2460dab8e4c23c1a2cfea335ee222ffb4",
    "trajectory_id": "evidence_trajectory_618de662e62b3e000aef3238c59b106b"
  },
  "fixture_id": "api-503-policy-approval-delivery",
  "fixture_sha256": "78a6e44810c27617c36cbdd665b9bf5c31e258a6a1103e102a1775543437134f",
  "fixture_source_path": "fixtures/policy/api-503-policy-approval-delivery.json",
  "operator_case_snapshot_id": "operator_case_snapshot_35d65b4ad7180fd2594a8531fc63851049a1779fe3028e36937aceb6e1c4afe1",
  "replay": {
    "mode": "verification_replay",
    "recorded_root_sha256": "bb1ac5250562383e75abfe7a275b282612e053dcf58531be56ed7c2e7d04a5d7",
    "replay_result_id": "trajectory_replay_ef70e8945c8b7163dbf7631d3572e57f",
    "replayed_root_sha256": "bb1ac5250562383e75abfe7a275b282612e053dcf58531be56ed7c2e7d04a5d7",
    "report_sha256": "05a67491a0fcf2fe6d1554040a2e03a0ec074f96c09014a07738a64741f9d227",
    "result_sha256": "a5edbf988a14e1da89d9208c87dc355de1efb2397c278179cb7cafd5abcce4b2",
    "verification_outcome": "verified"
  },
  "schema_id": "https://weflow.local/contracts/v1/operator-case-snapshot.schema.json",
  "schema_version": "v1",
  "snapshot_sha256": "35d65b4ad7180fd2594a8531fc63851049a1779fe3028e36937aceb6e1c4afe1",
  "source_report": {
    "report_id": "evidence_report_88547ee8d51c87cf84b99c1dcf6a907e",
    "report_profile_id": "fixture-local-evidence.v1",
    "report_sha256": "05a67491a0fcf2fe6d1554040a2e03a0ec074f96c09014a07738a64741f9d227",
    "retained_report_path": "reports/add-offline-operator-case-timeline-acceptance.json"
  },
  "tenant_id": "tenant-alpha",
  "timeline": [
    {
      "classification": "synthetic",
      "entry_id": "operator_entry_7fd5e320da4d93797c66c6291e1d98fb",
      "from_state": null,
      "gate_status": "not_applicable",
      "observation": "accepted",
      "phase": "intake",
      "predecessor_entry_id": null,
      "reason_code": "accepted_intake",
      "recovery_status": "not_required",
      "result": "recorded",
      "sequence": 1,
      "source_id": "accepted_intake:event_4a4707dccfe091d3570a2e3a5d93a239",
      "source_kind": "accepted_intake",
      "source_sha256": "21325f64344e29d9ba28636cd458887348dcf239cbfca9d36cd8e7d5196eb636",
      "to_state": null
    },
    {
      "classification": "synthetic",
      "entry_id": "operator_entry_8c10c7fb279efe2eb143f6faa50db333",
      "from_state": null,
      "gate_status": "not_applicable",
      "observation": "recorded",
      "phase": "case",
      "predecessor_entry_id": "operator_entry_7fd5e320da4d93797c66c6291e1d98fb",
      "reason_code": "revision_created",
      "recovery_status": "not_required",
      "result": "recorded",
      "sequence": 2,
      "source_id": "case_revision:case_revision_7479984cce61504b03058b9aca5ba2d7",
      "source_kind": "case_revision",
      "source_sha256": "8bbde6df088804db9e8378d004ffbcb59b720845396f8964a451e6b219c932a8",
      "to_state": null
    },
    {
      "classification": "synthetic",
      "entry_id": "operator_entry_c593b7bdd7b6eefa9d25de737266f192",
      "from_state": null,
      "gate_status": "not_applicable",
      "observation": "recorded",
      "phase": "case",
      "predecessor_entry_id": "operator_entry_8c10c7fb279efe2eb143f6faa50db333",
      "reason_code": "case_event_recorded",
      "recovery_status": "not_required",
      "result": "recorded",
      "sequence": 3,
      "source_id": "case_event:event_8ecb5cfa3d7b17848a9e7ed625e629dc",
      "source_kind": "case_event",
      "source_sha256": "c5c4f62d936d8f8568519d47b704ae072c71e83980a9177b02ee93435688b789",
      "to_state": null
    },
    {
      "classification": "synthetic",
      "entry_id": "operator_entry_5a009bc9e508249882e59ca8985681c0",
      "from_state": null,
      "gate_status": "not_applicable",
      "observation": "recorded",
      "phase": "case",
      "predecessor_entry_id": "operator_entry_c593b7bdd7b6eefa9d25de737266f192",
      "reason_code": "case_event_recorded",
      "recovery_status": "not_required",
      "result": "recorded",
      "sequence": 4,
      "source_id": "case_event:event_a2730b03c2be125bafdaaffbf078d2ac",
      "source_kind": "case_event",
      "source_sha256": "a55a2cd8fde84fa178f4c9e1d9a30c2a032c32f8e54966747872c789cbb00c41",
      "to_state": null
    },
    {
      "classification": "synthetic",
      "entry_id": "operator_entry_1d500cfa81f7c3e0e6dcc0e4828291a0",
      "from_state": null,
      "gate_status": "not_applicable",
      "observation": "recorded",
      "phase": "case",
      "predecessor_entry_id": "operator_entry_5a009bc9e508249882e59ca8985681c0",
      "reason_code": "case_event_recorded",
      "recovery_status": "not_required",
      "result": "recorded",
      "sequence": 5,
      "source_id": "case_event:event_7fca1370ec94bf407ebbee47d2c9abf8",
      "source_kind": "case_event",
      "source_sha256": "a8bd138e32f7e45a7f3c9ca0e52daa10549fdac5f7da6cdcc8ef7487a4b2d455",
      "to_state": null
    },
    {
      "classification": "synthetic",
      "entry_id": "operator_entry_ad657905917d692a091c32757a0a0fd7",
      "from_state": null,
      "gate_status": "not_applicable",
      "observation": "recorded",
      "phase": "case",
      "predecessor_entry_id": "operator_entry_1d500cfa81f7c3e0e6dcc0e4828291a0",
      "reason_code": "case_event_recorded",
      "recovery_status": "not_required",
      "result": "recorded",
      "sequence": 6,
      "source_id": "case_event:event_d12a2b5c5795b4429577b19d83020cb1",
      "source_kind": "case_event",
      "source_sha256": "4d951c36a12dcbbfa4f9177c31cc7b1e2189f758eeb29fa625e7d34837e2810d",
      "to_state": null
    },
    {
      "classification": "synthetic",
      "entry_id": "operator_entry_974f1d7c631686d4162274d35ff26f25",
      "from_state": null,
      "gate_status": "not_applicable",
      "observation": "recorded",
      "phase": "case",
      "predecessor_entry_id": "operator_entry_ad657905917d692a091c32757a0a0fd7",
      "reason_code": "case_event_recorded",
      "recovery_status": "not_required",
      "result": "recorded",
      "sequence": 7,
      "source_id": "case_event:event_a130ec21fdc2fad21a5dd3aa57841f0b",
      "source_kind": "case_event",
      "source_sha256": "d98ab99dcde0484f43d64dc7201605b0618ec9735ab75e4171e39514549091d8",
      "to_state": null
    },
    {
      "classification": "synthetic",
      "entry_id": "operator_entry_ae5272b68a8917d2b3563455d7aba266",
      "from_state": null,
      "gate_status": "not_applicable",
      "observation": "recorded",
      "phase": "case",
      "predecessor_entry_id": "operator_entry_974f1d7c631686d4162274d35ff26f25",
      "reason_code": "case_event_recorded",
      "recovery_status": "not_required",
      "result": "recorded",
      "sequence": 8,
      "source_id": "case_event:event_fd3d960f8ff5a431f0508a75f9c283af",
      "source_kind": "case_event",
      "source_sha256": "6f3b645f99ae62c0755e824b1b71bd17332eaa8bf1ac5e977af61c0e7a691c85",
      "to_state": null
    },
    {
      "classification": "synthetic",
      "entry_id": "operator_entry_7d88559fd8c6f2bc1ab08a2699c4553a",
      "from_state": null,
      "gate_status": "not_applicable",
      "observation": "recorded",
      "phase": "case",
      "predecessor_entry_id": "operator_entry_ae5272b68a8917d2b3563455d7aba266",
      "reason_code": "case_event_recorded",
      "recovery_status": "not_required",
      "result": "recorded",
      "sequence": 9,
      "source_id": "case_event:event_f8efd1a49b708b1efebfade1321c2008",
      "source_kind": "case_event",
      "source_sha256": "d101d8fe89bf1959cbe8a3c7359cfdea270c38bfa3579ed45de1d8c946a5ff34",
      "to_state": null
    },
    {
      "classification": "synthetic",
      "entry_id": "operator_entry_3310344f916dfcd785a7439cb700ddd3",
      "from_state": null,
      "gate_status": "not_applicable",
      "observation": "recorded",
      "phase": "case",
      "predecessor_entry_id": "operator_entry_7d88559fd8c6f2bc1ab08a2699c4553a",
      "reason_code": "case_event_recorded",
      "recovery_status": "not_required",
      "result": "recorded",
      "sequence": 10,
      "source_id": "case_event:event_d43400534a38cace704014c7649d0b19",
      "source_kind": "case_event",
      "source_sha256": "6fecd99e5ab6d094049e91f80896f9f3b31fb282be9e3cb3de494601eda5d1f0",
      "to_state": null
    },
    {
      "classification": "redacted",
      "entry_id": "operator_entry_0a78c0238e4a6d5a89ab3b3edd4f17c7",
      "from_state": null,
      "gate_status": "not_applicable",
      "observation": "recorded",
      "phase": "workflow",